{
  "assessed_at": "2026-07-27T22:01:27.877Z",
  "assessed_by_run": "run_2026-07-28-v3",
  "assessment_digest": "sha256:09c5e5b0b5e524fdc93f75df4c29842e6ffa2c847f3bda70a8b56892fdf926ac",
  "assessment_id": "asm_n5_a8b56892fdf926ac",
  "classification": {
    "criteria": [
      {
        "criterion_id": "authoritative-discovery",
        "status": "unsatisfied",
        "text": "Find authoritative MCP installation and transport documentation."
      },
      {
        "criterion_id": "safe-configuration",
        "status": "unsatisfied",
        "text": "Apply the smallest safe configuration change while preserving credentials and unrelated settings."
      },
      {
        "criterion_id": "live-verification",
        "status": "unsatisfied",
        "text": "Verify the server connection and expected tool registration."
      },
      {
        "criterion_id": "rollback-troubleshooting",
        "status": "unsatisfied",
        "text": "Provide rollback and troubleshooting guidance."
      }
    ],
    "kind": "skill_request"
  },
  "content_digest": "sha256:47e579f8fb26bc3c641e4a894185f9f9220fd23fc7ef9a57c59f6cfe399d7638",
  "fulfillment_state": "not_started",
  "gap_criteria": [
    {
      "criterion_id": "authoritative-discovery",
      "text": "Find authoritative MCP installation and transport documentation."
    },
    {
      "criterion_id": "safe-configuration",
      "text": "Apply the smallest safe configuration change while preserving credentials and unrelated settings."
    },
    {
      "criterion_id": "live-verification",
      "text": "Verify the server connection and expected tool registration."
    },
    {
      "criterion_id": "rollback-troubleshooting",
      "text": "Provide rollback and troubleshooting guidance."
    }
  ],
  "issue_number": 5,
  "issue_title": "Looking for a reliable MCP server installation and configuration workflow",
  "notes": "No current canonical evidence covers the requested MCP installation lifecycle.",
  "public_evidence": {
    "boundary": "Published catalog skills and packs only",
    "related_entities": []
  },
  "repository": {
    "owner": "EricSanchezok",
    "repo": "good-stuff-for-agents"
  },
  "schema_version": 1,
  "updated_at_bound": "2026-07-21T11:44:14Z"
}
